{
  "$schema": "https://json-schema.org/draft/2020-12/schema",
  "type": "object",
  "required": [
    "_id",
    "content",
    "courseId",
    "lessonId",
    "title"
  ],
  "properties": {
    "_id": {
      "$ref": "#/$defs/ObjectId"
    },
    "content": {
      "type": "string"
    },
    "courseId": {
      "type": "string"
    },
    "lessonId": {
      "type": "string"
    },
    "title": {
      "type": "string"
    }
  },
  "$defs": {
    "ObjectId": {
      "type": "object",
      "properties": {
        "$oid": {
          "type": "string",
          "pattern": "^[0-9a-fA-F]{24}$"
        }
      },
      "required": [
        "$oid"
      ],
      "additionalProperties": false
    }
  }
}